{
  "name": "scheduler",
  "version": "1.0.0",
  "description": "排程任務 CRUD、監看器、任務鏈",
  "type": "pre-installed",
  "depends_on": ["core"],
  "conflicts_with": [],
  "loading": {
    "rules": [
      "schedule-tool.md",
      "watcher-tool.md",
      "task-split-guide.md"
    ]
  },
  "triggers": {
    "keywords": ["排程", "定時", "提醒", "cron", "監看", "watcher"],
    "description": "排程工具 CLI 語法、參數、任務鏈和拆分指引"
  },
  "permissions": {
    "allow": [
      "Bash(uv run --directory *:*schedule_tool*)",
      "Bash(uv run --directory *:*watcher_tool*)"
    ],
    "deny": []
  },
  "prompt_hook": "prompt_hook.py",
  "placeholders": {
    "opentree_home": "auto"
  }
}
